{
  "schema_version": 1,
  "catalog_version": "2026.07.18.2",
  "source_locale": "en",
  "locale": "ko",
  "source_content_version": "2026.07.18.2",
  "review": {
    "status": "reviewed",
    "basis": "Korean learner-facing copy reconstructed from the reviewed G004 Korean source snapshot; invariant IDs, roles, relation directions, and safety structure are checked against the English source.",
    "reviewed_at": "2026-07-18",
    "evidence_id": "G009-KO-PRESENTATION-REVIEW-2026-07-18"
  },
  "worlds": [
    {
      "source_hash": "5da26148d50b8314ced8b3dabe982ca32c3f86f301ddf5d1db6c22c8972b331b",
      "profile_id": "P1",
      "world_id": "hospital-nursing",
      "label": "병원 간호: 의뢰·투약·기록·인계",
      "selection_aliases": [
        "보건·돌봄",
        "병원·간호",
        "병원 간호: 의뢰·투약·기록·인계"
      ]
    },
    {
      "source_hash": "4e32940976eb0332e2663a0b67e0d25016ef45bf4b2ecbf49000547a1b156f7f",
      "profile_id": "P2",
      "world_id": "small-ecommerce-operations",
      "label": "소규모 쇼핑몰 운영: 캠페인·주문·CS·리포트",
      "selection_aliases": [
        "판매·고객 응대",
        "운영·프로젝트 관리",
        "소규모 쇼핑몰 운영: 캠페인·주문·CS·리포트"
      ]
    },
    {
      "source_hash": "baf0d4d74314767d78e8052139b342790fcc86653a58e23333e29b7fd992af64",
      "profile_id": "P3",
      "world_id": "humanities-student",
      "label": "인문계 대학생: 과제·도서관·동아리 행사",
      "selection_aliases": [
        "교육·학습",
        "연구·분석",
        "콘텐츠·글쓰기",
        "인문계 대학생: 과제·도서관·동아리 행사"
      ]
    }
  ],
  "concepts": [
    {
      "source_hash": "27f8e6353fe6521dfb8659f48fc32554da5859127184067add86fc1d5ba3bfd6",
      "concept_id": "terminal-shell-command",
      "canonical_definition": "terminal은 문자 입력을 전달하고 출력 스트림을 표시하는 호스트/UI다. shell은 텍스트를 명령으로 해석하는 프로그램이다. command는 shell 문법의 실행 단위이며 외부 프로그램, builtin, 함수, pipeline일 수 있다.",
      "mechanism": {
        "actors": [
          "terminal",
          "shell",
          "command",
          "process",
          "stdout",
          "stderr"
        ],
        "flow": [
          "사용자 입력 → terminal → shell의 parsing·expansion → 실행 대상 선택 → process 실행 → stdout/stderr → terminal 표시."
        ]
      },
      "safety_boundary": [
        "명령 문자열보다 `현재 path, 정확한 target, side effect, 중지/복구 방법`을 먼저 표시한다."
      ],
      "analogy_breakpoint": "사람 접수자는 애매함을 보완하지만 shell은 quoting·expansion·pipe를 문자 규칙대로 처리하며 작은 차이가 파괴적 행동으로 이어질 수 있다.",
      "neutral_example": "`pwd`로 현재 작업 위치만 확인한다. 외부 상태를 바꾸지 않는다."
    },
    {
      "source_hash": "13eddbf3b8a06856788b68d1c80a541ae5166dc70d45e410c696631169d61964",
      "concept_id": "file-path-project-repository",
      "canonical_definition": "file은 OS가 읽고 쓸 수 있는 객체이고 path는 이를 식별하기 위해 해석되는 문자열이다. project는 한 작업의 도구별 범위다. Git repository는 refs와 object database로 이루어진 버전 이력 저장소이며 worktree가 없을 수도 있다.",
      "mechanism": {
        "actors": [
          "file",
          "path",
          "directory",
          "worktree",
          "index",
          "objects",
          "refs"
        ],
        "flow": [
          "상대 path는 현재 directory, 절대 path는 root부터 해석된다. Git은 worktree의 현재 파일과 index·objects·refs의 이력을 비교·기록한다."
        ]
      },
      "safety_boundary": [
        "recursive·delete·move 전에는 resolved absolute target과 repo root를 다시 확인한다."
      ],
      "analogy_breakpoint": "symlink/hard link 때문에 한 file에 여러 path가 생길 수 있고 repo는 단순 백업 폴더가 아니라 graph·refs·objects 구조다.",
      "neutral_example": "`pwd`, `git rev-parse --show-toplevel`, `git status --short`로 위치와 변경 상태를 읽는다."
    },
    {
      "source_hash": "fcc621e6a9a5ec0aa32a5ad4cce1856e9657d0526f7bb98932b5772fb7c67b18",
      "concept_id": "package-dependency",
      "canonical_definition": "package는 한 생태계가 배포·설치할 수 있도록 묶은 객체다. dependency는 project/package가 다른 package를 필요로 한다는 관계 또는 요구사항이다.",
      "mechanism": {
        "actors": [
          "manifest",
          "resolver",
          "package",
          "dependency",
          "artifact",
          "build/runtime"
        ],
        "flow": [
          "manifest에 요구사항 기록 → resolver가 버전·환경에 맞는 artifact 선택 → 직접·전이 의존성 설치 → build/runtime이 사용."
        ]
      },
      "safety_boundary": [
        "새 dependency는 필요성·maintainer·license·version·lockfile diff·script side effect를 확인한 뒤 설치한다."
      ],
      "analogy_breakpoint": "package는 실행 코드이며 전이 의존성, platform 조건, version conflict, 악성 공급망 위험이 있다.",
      "neutral_example": "설치 전 manifest의 dependency 항목과 예상 lockfile diff를 확인한다. 예시 package `example-lib`의 실제 설치는 하지 않는다."
    },
    {
      "source_hash": "dbbe5beca61550ad8ed3f5eab20155c778d0ac6a38736ceb5308a077dc77f053",
      "concept_id": "process-server",
      "canonical_definition": "program은 저장된 명령이고 process는 그것이 실행 중인 주소 공간·thread·자원 묶음이다. 이 카드의 HTTP 문맥에서 server는 연결·요청을 받아 응답하는 software role이다. 다만 infrastructure 문맥에서는 그 역할을 수행하는 physical machine·VM도 `server`라고 부를 수 있으므로 문맥을 함께 확인한다.",
      "mechanism": {
        "actors": [
          "command",
          "operating system",
          "process",
          "server",
          "client",
          "database/API"
        ],
        "flow": [
          "command 실행 → OS가 process 생성 → server가 host/port에 listen → client request → 처리·필요 시 DB/API 호출 → response → 다음 요청 대기."
        ]
      },
      "safety_boundary": [
        "bind 주소, 공개 directory, port, secret 존재, production 적합성, 종료 방법을 확인한다."
      ],
      "analogy_breakpoint": "실제 server는 proxy·여러 process/instance·동시 요청으로 구성될 수 있고 같은 program이 연결에 따라 client와 server 양쪽 역할을 할 수 있다.",
      "neutral_example": "secret이 없는 전용 `public-demo`만 `127.0.0.1`에 bind해 임시 정적 server로 열고 Ctrl-C로 종료한다. home/project root는 공유하지 않는다."
    },
    {
      "source_hash": "3f28d211ab00a0098fe9148d55a2a48be7801790f1d28e49cbf9991de9c0819c",
      "concept_id": "database-table-query",
      "canonical_definition": "relational DBMS는 relation/table 형태의 데이터를 관리한다. table은 같은 named column을 가진 row의 named collection이고 query는 DBMS에 결과나 처리를 요구하는 구조화된 요청이다.",
      "mechanism": {
        "actors": ["app/CLI", "DBMS", "table", "index", "result/status/error"],
        "flow": [
          "app/CLI가 SQL 전송 → DBMS가 문법·권한·constraint 확인 → table/index에서 처리 → result row 또는 status/error 반환."
        ]
      },
      "safety_boundary": [
        "production 여부, backup, transaction, 대상 row count, migration rollback을 확인하지 않은 write query는 자동 실행하지 않는다."
      ],
      "analogy_breakpoint": "실제 DB에는 transaction, constraint, index, join, concurrency, NULL, optimizer가 있어 단순 서랍장·spreadsheet와 다르다.",
      "neutral_example": "`SELECT 2 + 2 AS answer;`처럼 저장 데이터를 바꾸지 않는 query로 시작하고, 수정 전에는 제한 조건을 둔 `SELECT`로 대상 row를 확인한다."
    },
    {
      "source_hash": "7e584706c551dc2310cd95996042cd7dc6cd5e388066228e9f468830fbc59dca",
      "concept_id": "api-request-response",
      "canonical_definition": "API는 software가 다른 software와 상호작용하도록 정한 syntax·semantics·rules의 interface다. HTTP API에서는 client가 method·target·headers·선택적 body의 request를 보내고 server가 status·headers·선택적 body의 response를 돌려준다.",
      "mechanism": {
        "actors": ["client", "endpoint", "server", "request", "response"],
        "flow": [
          "client가 계약에 맞춰 request 구성 → endpoint가 검증·권한 확인·처리 → 성공/오류 response → client가 status와 content 해석."
        ]
      },
      "safety_boundary": [
        "외부 write API는 endpoint·method·account·scope·cost·idempotency·rollback을 승인 전에 표시한다."
      ],
      "analogy_breakpoint": "사람 창구처럼 애매한 요청을 알아서 해석하지 않고 schema·method·rate limit·retry·partial failure가 있다.",
      "neutral_example": "가상의 read-only `GET /tasks/42`가 `200 OK`와 JSON을 반환하는 흐름을 trace한다. 실제 호출 전 method·target·비용·credential을 확인한다."
    },
    {
      "source_hash": "0431d2f9109002de9cb8cc23b5d7e9cd6734e07d5a4c16a933efa3284f7511f8",
      "concept_id": "credential-api-key-access-token",
      "canonical_definition": "credential은 접근 주체·권한을 증명하는 정보다. API key는 서비스가 발급한 비밀 문자열로 project/app 식별·quota·접근 확인에 쓰이지만 정확한 의미는 공급자별이다. OAuth access token은 보호된 resource에 대한 scope·대상·기간 등의 위임 권한을 표현한다.",
      "mechanism": {
        "actors": [
          "client",
          "authorization server",
          "resource server",
          "API key",
          "access token"
        ],
        "flow": [
          "key는 server-side secret 저장소에서 읽어 HTTPS request에 포함한다. OAuth는 authorization 후 token 획득 → resource server 제출 → 유효성·audience/resource·scope 확인 순서다."
        ]
      },
      "safety_boundary": [
        "frontend·repo·chat·screenshot·log·URL에 실제 secret을 표시하지 않는다. 최소 scope, HTTPS, audience 검증, 별도 downstream token, revoke/rotate 절차를 유지한다."
      ],
      "analogy_breakpoint": "token은 사람을 항상 대표하지 않고 불투명할 수 있으며 공급자마다 API key 권한 모델이 다르다. 디지털 secret은 소유자 모르게 무한 복사될 수 있다.",
      "neutral_example": "`.env.example`에는 `OPENAI_API_KEY=replace_me`만 두고 실제 값은 server 환경변수/secret manager에 저장한다. 이미 노출됐다면 삭제보다 revoke/rotate가 먼저다."
    },
    {
      "source_hash": "f9fca8cef1dae0291f1f33bd09c14865a03eaf95928bfa1638b57d1e95301dd6",
      "concept_id": "llm-token-context-window",
      "canonical_definition": "LLM token은 모델이 입력·출력을 처리하는 원자적 단위다. context window는 한 요청에서 처리할 수 있는 입력·출력·reasoning 등의 전체 token 작업 공간 한도다.",
      "mechanism": {
        "actors": [
          "provider/model tokenizer",
          "input token sequence",
          "model",
          "output token",
          "context window"
        ],
        "flow": [
          "provider/model별 tokenizer가 input을 token sequence로 변환 → model이 sequence 처리 → output token 생성 → usage·cost·context가 해당 provider/model 규칙의 token 수로 계산된다. tool·image·document·thinking 처리 방식도 공급자와 모델에 따라 달라질 수 있다."
        ]
      },
      "safety_boundary": [
        "비용 추정에는 실제 model-specific count를 쓰고 secret·불필요한 개인정보를 context에 넣지 않는다."
      ],
      "analogy_breakpoint": "token은 인간의 단어·의미 단위와 일치하지 않고 token 수가 정보 중요도·사실 개수를 뜻하지 않는다.",
      "neutral_example": "거친 글자 수 추정 대신 실제 사용 provider·model·messages·tool schema를 대상으로 해당 공급자의 공식 counting API/tokenizer를 사용하고 핵심 결정은 외부 정본에 저장한다."
    },
    {
      "source_hash": "112c80c0c7947e6d9d32e2147bf330b1539a32f78d15ea4f68baa0b68177eccd",
      "concept_id": "mcp-tool-resource",